vraag,antwoord
Wie is de vrouwelijke president van Suriname, Jennifer Geerlings-Simons
Wie is de vrouwelijke president van Mexico, Claudia Sheinbaum
Wie is de vrouwelijke president van Namibië«, Nandi-Ndaitwah
Wie is de vrouwelijke president van IJsland, Tomasdottir
Hoe heet de podcast van Alina Churikova over economie, Kop of Munt
Hoe heet de podcast van Veerle Duflou over lichamen aan de wetenschap, Stoffelijk
Hoe heet de podcast van Debby De Ridder over gedwongen huwelijk, Voor de eer
Hoe heet de podcast van Wim Oosterlinck over boeken, Drie boeken
Hoe heet de podcast over Royal Antwerp FC, De vierkante paal
Hoe heet de podcast van Sofie Verschueren over rouw en afscheid, Weg
Wie maakten de podcast over gangster Lacroix, Marjan Mutsaert en Lise Bonduelle
Wie maakte de podcast over zuster Gabrielle, Philippe Heymans
Hoe heet het bedevaartsoord in Peruwelz, Onze Lieve Vrouw Bon Secours
Wiens mirakel maakte van Oostakker Lourdes een bedevaartsoord, Pieter De Rudder
Welke Heilige wordt gevierd in de Fiertel, Sint Hermes
Hoe heet het ziekenhuis in Lessen, Notre dame de la rose
Waar ligt het grootste Duitse soldatenkerkhof, Langemark
Hoe heet het soldatenkerkhof nabij Bastogne, Mardasson
hoe heet de sporza-presentatrice die tegenwoordig de meeste uitzendingen doet, Astrid Demeure
Hoe heet mevrouw Bezos, Lauren Sanchez
Hoe heet de presentatrice van stubru en vtm die deed alsof ze zou trouwen, Flo Windey
Welke beroemde dragqueen presenteert een show die haar naam draagt gevolgd door Drag Race, Rupaul
Hoe heet de dochter van actrice Candice Bergen die journalist werd bij Vogue, Chloe Malle
hoe heet de zanger van noir desir en wie sloeg hij dood, bertrand cantat en marie trintignant
welke komiek was de vriend van miou miou, coluche
Welke Duitse expressionistische beeldhouwer is bekend om zijn langgerekte menselijke figuren zoals De Denker uit 1918?,Wilhelm Lehmbruck
Kleine Japanse kunstbeeldjes die vaak aan kimono’s werden bevestigd,Netsuke
Welke Vlaamse beeldhouwer maakte de beroemde Brabofontein in Antwerpen?,Jef Lambeau
Welke Duitse kunstenaar is bekend van de reeks Volk Ding Zero?,Georg Baselitz
Wie ontwierp het Holocaustmonument in Berlijn?,Peter Eisenman
Welke Deense beeldhouwer maakte het beroemde Christusbeeld in de Domkerk van Kopenhagen?,Bertel Thorvaldsen
Welke middeleeuwse beeldengroep bevindt zich in Dijon en toont Mozes bij de bron?,Mosesput van Sluter
Welke Belgische beeldhouwer maakte moderne monumentale werken zoals het Atomium-paviljoen?,Olivier Strébelle
Welke Belgische romanticus uit Dinant maakte dramatische expressieve schilderijen en mythologische taferelen?,Antoine Wiertz
Welke Franse schilder staat bekend om zijn raadselachtige sensuele interieurscènes?,Balthus
Welke Venetiaanse renaissanceschilder was leerling van Bellini en leraar van Giorgione?,Vittore Carpaccio
Welke voorstelling uit de schilderkunst toont de vergankelijkheid van het leven aan de hand van symbolen zoals schedels en zandlopers?,Vanitas
Welke Duitse architect en ingenieur was pionier in lichtgewicht constructies en trekstructuren?,Otto Frei
De schil van een vrucht (meestal tomaat of amandel) verwijderen door ze kort in kokend water te dompelen en daarna in koud water te leggen, Emonderen
Snel bakken in weinig vetstof op hoge temperatuur meestal in een koekenpan of sauteerpan, Sauteren
Na het bakken het aanbaksel in de pan loskoken met vocht om een saus te maken, Deglaceren
Aan het einde van de bereiding koude boterklontjes door een saus kloppen om ze glanzend en voller van smaak te maken, Monteren
In zeer kleine blokjes gesneden groenten (2 tot 3 millimeter), Brunoise
Bladgroenten (zoals basilicum of spinazie) in fijne reepjes gesneden, chiffonade
Grotere onregelmatige stukjes groenten vaak voor soep of stoofpot, paysanne
Tomaten ontpitten ontvellen (emonderen) en in blokjes snijden, Concasseren
Onnodige delen (zoals vet of vliezen) van vlees of vis wegsnijden, Pareren
Vlees of gevogelte in plakken snijden vaak aan tafel, trancheren
Een pasta van boter en bloem gebruikt om een saus te binden, Beurre manié
Een lichte saus op basis van bouillon en een blonde roux, vélouté
Wie won nobelprijs voor de vrede in 2025, Maria Corina Machado
In de Juwelenroof uit het Louvre werd een toestel gebruikt, haakse slijper
Uit welke galerij in het Louvre werden de juwelen gestolen, Gallerie d’Appolon
Hoe heet het ierse architectenbureau dat het Groot Egyptisch Museum bouwde, Heneghan Peng
Welke Surinaamse ex-president is onlangs overleden, Ronald Venetiaan
Welk slachtoffer van Epstein pleegde zelfmoord, Virginia Giuffre - schandaal
Hoe heet het verdwenen dorp door een berglawine, Blatten
Welke rivier overstroomde in Texas en hoe heet het kamp waar jongeren verdronken, Guadelupe en Camp Mystic
Vluchtnummer en plaats van de neergestorte Boeing van Air India, Ahemdabad 171
Hoe heet de Orkaan die nu Jamaica verwoest, Melissa
In welke staat stortte een vliegtuig van UPS neer, Kentucky
Welke klunzen pleegden een mislukte aanslag op Trump, Thomas Crooks en Ryan Routh
Wie vermoordde Charlie Kirk, Tyler Robinson
Wie vermoordde democrate Melissa Hortman, Vance Luther Boelter
Wie pleegde de moord op Brian Thompson van de gezondheidsverzekering, Luigi Mangione
Wie is de leider van Hezbollah, HASSAN NASRALLAH
Commissaris-generaal van de Belgische federale politie sinds 2020, Eric Snoeck
Hoe heet de Brusselse procureur die de drugswereld de oorlog verklaarde, Julien Moinil
Welke burgemeester van Istanboel is een gevaar voor Erdogan, Imamoglu
Is een Saoedische activiste voor vrouwenrechten en een prominente vlogster die nu huisarrest heeft, Loujain al-Hathloul
Hoe heet het grote Belgische wielertalent, Jarno Widar
Wie werd wereldkampioene wielrennen in 2025, Magdalene Vallieres
Welke Ethiopische was revelatie op het WK wielrennen 2025, Tigre Kiros
Wie won de wereldtitel tijdrijden bij de vrouwen in 2025, Marleen Reusser
Welke Belgische moest stoppen met wielrennen vanwege mechanische doping, Femke Vandendriessche
Welke Belgische veldrijdster overleed in 2021 aan kanker?, Jolien Verschueren
Wie was de Winnares van de ronde van Frankrijk 2025, Pauline Ferrand-Prévot
Welke Belg werd 3de in het tijdrijden in het WK van 2025, Ilan van Wilder
Welke Belg werd 3de bij de junioren in het WK van 2025?, Steff Van Kerckhove
Welke bokser wordt soms wel eens de echte Shrek genoemd?, Maurice Thillet
Welke bobsleeêr en avonturier kwam om bij een duik in een grot?, Marc Sluszny
Welke Georgische rodelaar kwam om het leven tijdens de training voor de Olympische Winterspelen 2010?, Nodar Kumaratischvili
Welke shorttracker won Olympisch goud voor zowel Zuid-Korea als Rusland?, Victor Ahn
Hoe heet de spelonderbreking in ijshockey wanneer de puck vanaf eigen helft direct over de doellijn wordt gespeeld zonder dat iemand hem aanraakt?, Icing
Hoe heten de oude en nieuwe bondscoach Red Flames,Serneels en Gunnarsdottir
Hoe heet de Nederlandse bondscoach van Engeland, Sarina Wiegman
Hoe heet de Italiaanse drievoudige winnares van de Ballon d’Or, Bonmati
Hoe heet de heilige bron in Mekka, Zamzam
Hoe heet een hoofdstuk en een vers in de Koran, Soera en Ayat
Hoe heet de spreuk van de Islam, Sjahada
Wat is het woord voor “waarheid” in het Indisch? Het is een belangrijk concept in de diverse godsdiensten van het land en komt ook voor in het embleem, Sach
Hoe heten eenzame en gemeenzame monniken, heremieten en cenobieten
Welke heilige van Alexandrië is beschermheilige der tandartsen?, Appolonia
Hoe heet de orde van missionarissen die omkwamen in bokseropstand, Scheutisten
Welke Bijbelse of mythische monsterfiguur staat symbool voor chaos?, Behemot
Welke zeemonsterfiguur komt voor in de Bijbel en de politieke filosofie van Hobbes?, Leviathan
Tot welke christelijke gemeenschap in Libanon behoren veel volgelingen van het patriarchaat?, Maronieten
Hoe heet in de katholieke theologie de leer dat brood en wijn werkelijk in het lichaam en bloed van Christus veranderen?, Transsubstantiatie
Hoe heet het katholieke feest dat op 1 januari wordt gevierd acht dagen na Kerstmis?, Besnijdenis van de Heer
Welke Heilige wordt in de kunst wordt de heilige voorgesteld als bisschop met een beer of wolf beide symbool voor het heidendom?, vedastus
Hoe heette de oudste bekende veldslag namelijk tussen de Egyptenaren en de Kanaanieten,De Slag bij Megiddo
Welke Perzische koning werd verslagen in de slag bij Marathon, Darius I
Waar versloegen de Perzen de Spartanen en hun bondgenoten, Slag bij Thermopylae
Waar behaalde Alexander de Grote een beslissende overwinning  tegen Perzië, Gaugamela
Wat was de eerste slag en Romeinse overwinning in de Eerste Punische Oorlog, Slag bij Agrigentum
Bij welke kleine rivier versloeg Julius Caesar de Nerviërs, Slag bij de Sabis
Waar vochten Marcus Antonius en Octavianus een onbesliste strijd uit tegen Marcus Brutus en Cassius, Eerste Slag bij Philippi
Hoe heet de slag waarbij de Romeinen onder Aëtius en de Visigoten onder Theoderik I de Hunnen bekampten, Slag op de Catalaunische Velden
Waar versloeg Clovis Syagrius en annexeerde hij de laatste Romeinse provincies in Gallië, Slag bij Soissons
Waar vochten Friezen tegen Franken, Slag bij Dorestad
In 1066 versloeg Harold II van Engeland zijn tegenstander Harald Hardrada in de strijd voor de Engelse troon, Slag bij Stamford Bridge
Waar versloeg William Wallace de Engelsen, Stirling Bridge
Waar versloegen boogschutters onder Hendrik V van Engeland deFransen onder Karel I van Albret, Azincourt
In welke oostvlaamse gemeente onderwierpen de Bourgondiërs Gent, Slag bij Gavere
Waar werd Richard III van Engeland verslagen door Hendrik Tudor, Slag bij Bosworth
Waar werd een calvinistisch rebellenleger door een 'Spaans' beroepsleger in de pan gehakt en begon de Tachtigjarige Oorlog, Slag bij Oosterweel
In welke badstad versloeg Prins Maurits een Spaans leger, Slag bij Nieuwpoort
Waar versloeg Willem III zijn rivaal Jacobus II van Engeland, Battle of the Boyne
Waar vonden de openingsveldslagen van de Amerikaanse Onafhankelijkheidsoorlog plaats, Slagen van Lexington en Concord
Waar in België versloegen De Fransen een gecombineerde Oostenrijks-Nederlands-Engelse legermacht, Slag bij Fleurus
Wat was de grootste veldslag tussen de Grande Armée van Napoleon en de Russen onder generaal Koetoezov, Slag bij Borodino
Welke slag die we kennen als de volkerenslag leverde Napoleon een grote nederlaag op in Duitsland, Leipzig
Waar versloeg Generaal Santa Anna  de Texanen en vond David Crockett de dood, Alamo
Wat is het motto van de Verenigde Staten die de eenheid van de staten uitdrukt, E pluribus unum
Welke leuze van de Verenigde Staten staat op de dollarbiljetten, In God we trust
Wat is het Koninklijk motto van het Verenigd Koninkrijk (sinds Richard Leeuwenhart), Dieu et mon droit
Wat is het devies van de Orde van de Kousenband (Britse ridderorde), Honi soit qui mal y pense
Wat is het motto van de Amerikaanse Mariniers, Semper fidelis 
Wat is het motto van  van de Amerikaanse kustwacht, Semper paratus
Wat is de nationale leuze van Canada, A mari usque ad mare
Wat is de Duitse nationale leuze en begin van het volkslied, Einigkeit und Recht und Freiheit
Wat is de  Revolutionaire leuze uit Cuba, Patria o muerte
Wat was het Motto van de Oostenrijks-Hongaarse monarchie, Indivisibiliter ac inseparabiliter
Welk militair devies halen we bij Vergilius, Audaces fortuna iuvat
Welk motto haalde  de Pruisisce orde bij Cicero, Suum cuique
Welk klassiek motto gebruikte Bart De Wever bij zijn verkiezingsoverwinning, Ad astra per aspera
Wie is de auteur van de beroemde strip Fritz the Cat?, Robert Crumb
Wat is de nieuwe vernederlandste naam van Assurancetourix?, Kakafonix
Wie tekende de strips van Natasja en Rubine,François Walthéry
Welke scenarioschrijvers werkten samen met Walthéry?, Mythic en Dragan de Lazare
Welke Italiaanse striptekenaar staat bekend om zijn erotisch werk, Milo Manara
Wie is de auteur van Jugurtha Jeremiah en De torens van Schemerwoude,Hermann
Welke stripreeks van Christin en Mézières geldt als klassieker in de sciencefiction?,Ravian Valérian
Hoe heet de stripreeks van François Schuiten en Benoît Peeters over imaginaire art-deco steden?,De duistere steden
Welke Amerikaanse bijnaam verwijst naar een lid van een beruchte bende en werd later een stripfiguur?,Bulger
Wie won de prijs voor beste roman van de Académie Française in 2025 met Passagères de nuit, Yanick Lahens
Wie won de prix Goncourt in 2025 met La Maison vide, Laurent Mauvignier
Wie won de prix Femina in 2025 met haar verhalen over femicide in Martinique, Natascha Appanah
Hoe noemen we een technocratie met een machtig staatsapparaat, corporatisme
Hoe heet een marktsituatie met weinig aanbieders, oligopolie
Welke vlaamse wetenschapper is gespecialiseerd in onderhandelingstechnieken, dirk van poucke
Welke theorie vervangt die van de onzichtbare hand in het model van Kahneman, prospect theory
Welke Engelse term beschrijft een economie die regeneratief is en houdbaar, cradle to cradle
Hoe heet de fraude waarbij je opgebeld wordt door bots om je te verleiden terug te bellen, Wangiri 
Hoe heet een goed met een omgekeerde prijs-vraag-wet, Giffen-goed
Hoe heet een luxegoed waar een hogere prijs het item aanlokkelijker maakt, Veblen-goed 
Welke wet beschrijft dat het percentage dat naar voeding gaat daalt naarmate men rijker is, wet van Engel
Welke theorie beweert dat de armen mee profiteren van de rijken doordat die hun geld investeren, trickle down theorie
Hoe heet de lijn op 100 km hoogte die bepaalt of het nog luchtvaart is of al ruimtevaart, kármánlijn
Welke Oekraïense pionier leverde helikopters aan de VS, Sikorsky
Hoe heet de schaal met UFO waarnemingen waaronder close encounters of the thrid kind, schaal van Hynek
Welke maanlanding met een Falcon SpaceX werd uitgevoerd door Firefly Aerospace, Blue Ghost
Welke maanlanding met een Falcon SpaceX werd uitgevoerd door Intuitive Machines, Athena
Hoe heetten de Russische hondjes die in 1951 een ruimtevlucht maakten, Tsygan en Dezik
Hoe heette de aap die in 1949 een ruimtevlucht maakte, Albert
Wie is de voorzitster van het IOC?, Kirsty Coventry 
Hoe heet de voorzitter van de Vlaamse atletiekfederatie en de hoofdcoach?, Gery Follens en Rutger Smith
Hoe heet de voorzitster van de Waalse atletiekfederatie?, Jessica Mayon
Welke speelster leidt het conflict tegen de WNBA en wie is daar de voorzitster van?, Napheesa Collier vs Cathy Engelbert
Welke ex-baas van Red Bull is getrouwd met Geri Haliwell?, Horner
Welke ex-ruiter pleegde zelfmoord doordat hij de dood van enkele van zijn paarden niet kon verwerken?, Eric Wauters
Eric Wauters werd driemaal Belgisch kampioen en behaalde samen met Edgard-Henri Cuepper, François Mathy en Stanny Van Paesschen een bronzen medaille op de jumping per ploeg op de Olympische 
Welke Amerikaanse schaker pleede zelfmoord na door Kramnik beschuldig te zijn van valsspelen?, Daniel Naroditsky
